key,name,description,title.default,title.en_US,title.de_DE,subtitle.default,subtitle.en_US,subtitle.de_DE,image_url.default,image_url.en_US,image_url.de_DE,click_url.default,click_url.en_US,click_url.de_DE,alt_text.default,alt_text.en_US,alt_text.de_DE
br-smartwatches,Big Banner Smartwatches,Smartwatches promotion redirecting to a dedicated Smartwatches landing page.,The freedom of cellular,The freedom of cellular,Die Freiheit an der Hand,Explore the world of smartwatches.,Explore the world of smartwatches.,Entdecke die Welt der Smartwatches.,//www.de.suite.local/assets/images/section-slider-item-image-10@2x.png,/assets/images/section-slider-item-image-10@2x.png,/assets/images/section-slider-item-image-10@2x.png,//en/smart-wearables/smartwatches,///en/smart-wearables/smartwatches,///de/smart-wearables/smartwatches,The freedom of cellular,The freedom of cellular,Die Freiheit an der Hand
br-smartphones,Big Banner Smartphones,Smartphones promotion redirecting to Smartphones category page.,Your life in your pocket,Your life in your pocket,Dein Leben in deiner Tasche,Explore the next generation of smartphones.,Explore the next generation of smartphones.,Entdecke die nächste Smartphone-Generation.,/assets/images/section-slider-item-image-6@2x.png,/assets/images/section-slider-item-image-6@2x.png,/assets/images/section-slider-item-image-6@2x.png,///en/telecom-&-navigation/smartphones,///en/telecom-&-navigation/smartphones,///de/telekommunikation-&-navigation/smartphones,Your life in your pocket,Your life in your pocket,Dein Leben in deiner Tasche
br-tablet,Big Banner Tablets,Tablets promotion redirecting to Tablets category page.,Power for what you do,Power for what you do,Power für deine Ideen,Explore the latest tablets.,Explore the latest tablets.,Entdecke die neuesten Tablets.,/assets/images/section-slider-item-image-7@2x.png,//www.de.suite.local/assets/images/section-slider-item-image-7@2x.png,/assets/images/section-slider-item-image-7@2x.png,///en/computers/tablets,///en/computers/tablets,///de/computer/tablets,Power for what you do,Power for what you do,Power für deine Ideen
br-the-freedom-of-cellular,The Freedom of Cellular,Explore the world of Smartwatches,The Freedom of Cellular,The Freedom of Cellular,Die Freiheit von Cellular,Explore the world of Smartwatches,Explore the world of Smartwatches,Entdecken Sie die Welt der Smartwatches,/assets/images/banner-image.jpg,/assets/images/banner-image.jpg,/assets/images/banner-image.jpg,http://#,http://#,http://#,The Freedom of Cellular,The Freedom of Cellular,Die Freiheit von Cellular
br-white-or-black,White or Black?,Is white or black the cooler color for your new smartwatch?,White or Black?,White or Black?,Weiß oder schwarz?,Is white or black the cooler color for your new smartwatch?,Is white or black the cooler color for your new smartwatch?,Ist Weiß oder Schwarz die coolere Farbe für Ihre neue Smartwatch?,/assets/images/banner-image.jpg,/assets/images/photo-background.png,/assets/images/photo-background.png,http://#,http://#,http://#,The Freedom of Cellular,The Freedom of Cellular,Die Freiheit von Cellular
